{
  "report_version": "v0.0.1",
  "drill_id": "D2",
  "run_id": "run_openclaw_d2_2026_02_01",
  "executed_at": "2026-09-19T19:20:00Z",
  "environment": "staging-with-prod-like-policy",
  "owner_id": "team.ops",
  "witness_ids": [
    "user.security"
  ],
  "workflow_ids": [
    "wf.openclaw.assistant"
  ],
  "result": "pass",
  "scorecard_ref": "artifacts/openclaw/drills/d2/scorecard.md",
  "evidence_refs": [
    "artifacts/openclaw/drills/d2/revoke-log.json"
  ],
  "audit_completeness_preserved": true,
  "revocation_within_budget": true
}
