{
  "report_version": "v0.0.1",
  "drill_id": "D-OC-03",
  "run_id": "run_openclaw_doc03_2026_02_01",
  "executed_at": "2026-09-19T19:55:00Z",
  "environment": "staging-with-prod-like-policy",
  "owner_id": "team.ops",
  "witness_ids": [
    "user.security"
  ],
  "workflow_ids": [
    "wf.openclaw.assistant"
  ],
  "result": "pass",
  "scorecard_ref": "artifacts/openclaw/drills/doc03/scorecard.md",
  "evidence_refs": [
    "artifacts/openclaw/drills/doc03/sandbox-exec-log.json",
    "artifacts/openclaw/drills/doc03/containment-verification.json"
  ],
  "overlay_context": {
    "openclaw": {
      "assertions": {
        "non_main_session_sandboxed": true,
        "host_filesystem_traversal_blocked": true,
        "unauthorized_network_egress_blocked": true
      }
    }
  },
  "notes": "Non-main-session tool calls executed under sandbox constraints."
}
