{
  "report_version": "v0.0.1",
  "drill_id": "D-CC-11",
  "run_id": "run_claude_code_dcc11_2026_05_01",
  "executed_at": "2026-09-19T21:05:00Z",
  "environment": "staging-with-prod-like-policy",
  "owner_id": "team.platform",
  "witness_ids": [
    "user.security"
  ],
  "workflow_ids": [
    "wf.claude_code.assistant"
  ],
  "result": "pass",
  "scorecard_ref": "artifacts/claude-code/drills/dcc11/scorecard.md",
  "evidence_refs": [
    "artifacts/claude-code/drills/dcc11/skill-subagent-manifest.json",
    "artifacts/claude-code/drills/dcc11/revocation-check.log"
  ],
  "overlay_context": {
    "claude_code": {
      "assertions": {
        "skill_or_subagent_inventory_present": true,
        "skill_or_subagent_boundary_enforced": true,
        "skill_or_subagent_revocation_verified": true
      }
    }
  },
  "notes": "Skills and subagents remained inside declared boundaries and revocation blocked reuse."
}
