{
  "report_version": "v0.0.1",
  "drill_id": "D-CX-07",
  "run_id": "run_codex_dcx07_2026_05_01",
  "executed_at": "2026-09-19T21:00:00Z",
  "environment": "staging-with-prod-like-policy",
  "owner_id": "team.platform",
  "witness_ids": [
    "user.security"
  ],
  "workflow_ids": [
    "wf.codex.assistant"
  ],
  "result": "pass",
  "scorecard_ref": "artifacts/codex/drills/dcx07/scorecard.md",
  "evidence_refs": [
    "artifacts/codex/drills/dcx07/revocation-timeline.csv",
    "artifacts/codex/drills/dcx07/post-revoke-deny.log"
  ],
  "m1_time_to_revoke_ms_p95": 15000,
  "overlay_context": {
    "codex": {
      "assertions": {
        "revocation_callable_by_oncall": true,
        "revocation_within_slo": true,
        "post_revoke_high_risk_blocked": true
      }
    }
  },
  "notes": "Revocation completed within SLO and blocked subsequent high-risk actions."
}
