{
  "report_version": "v0.0.1",
  "drill_id": "D1",
  "run_id": "run_codex_d1_2026_05_01",
  "executed_at": "2026-09-19T16:00:00Z",
  "environment": "staging-with-prod-like-policy",
  "owner_id": "team.platform",
  "witness_ids": [
    "user.security"
  ],
  "workflow_ids": [
    "wf.codex.assistant"
  ],
  "result": "pass",
  "scorecard_ref": "artifacts/codex/drills/d1/scorecard.md",
  "evidence_refs": [
    "artifacts/codex/drills/d1/receipt-pack.json",
    "artifacts/codex/drills/d1/timeline.csv"
  ],
  "chain_reconstruction_ok": true,
  "revocation_within_budget": true,
  "m2_approval_latency_ms_p95": 39000,
  "notes": "D1 passed with full chain reconstruction and correct approve/deny path."
}
